"abbreviation","name","short description"
"Qmbi","Basalt dike"," Dark-gray to black plagioclase-aphyric basalt with abundant 1- to 3-cm plagioclase laths in groundmass of olivine, clinopyroxene, plagioclase, and magnetite. Contains baked xenoliths of sandstone of the Moenkopi Formation Ulrich and Bailey, 1987. Includes (...)"
"Qmcb","Basalt flow of Merriam Crater"," Dark-gray alkali olivine basalt. Contains scattered phenocrysts of olivine, clinopyroxene, and rare plagioclase in groundmass of the same minerals plus opaque oxides. Basalt flow originated from Merriam Crater 17.5 km 11 mi southeast of the southeast corn (...)"
"Qmlp","Basalt flow of Lava Point"," Dark-gray to black plagioclase-aphyric basalt. Similar composition to Qmb basalt flows. Mapped as Lava Point flow (Qmb) by Ulrich and Bailey (1987) east of U.S Highway 89 but not mapped separately from other basalt flows of similar composition and age. Ma (...)"
"Qmp","Pyroclastic deposits"," Dark-gray to reddish-brown plagioclase-aphyric and porphyritic basalt. Consist of intergranular groundmass of plagioclase, clinopyroxene, olivine, and magnetite. Contain scattered olivine and clinopyroxene phenocrysts. Include several cones of Mesa Butte  (...)"
"Qmrb","Basalt of Marshall Ranch, basalt flows"," Gray-black, finely crystalline, alkali-olivine basalt. Majority of basalt flowed in radial pattern from south pyroclastic cone. Basalt also flowed west about 3 km 2 mi. Partly overlie the basalt of Potato Valley (Qpvb) at south margin and overlie Harrisbu (...)"
"Qmrp","Basalt of Marshall Ranch, pyroclastic deposits"," Reddish-black and red tuff, ash, scoriaceous ejecta, and cinders overlie associated basalt flows. Include two unnamed pyroclastic cones and three smaller secondary spatter cones. Secondary cones appear to have erupted from basalt flows that came from sout (...)"
"Qp","",""
"Qp1","Basalt of the Uinkaret Plateau, pyroclastic deposits, north of Mount Trumbull"," Reddish-gray, black, and red to gray tuff, ash, scoriaceous ejecta, bombs, and cinder deposits; partly consolidated. Include about 17 pyroclastic deposits north of Mount Trumbull Qp1 such as Craigs Knoll and about 36 pyroclastic vents south of Mount Trumb (...)"
"Qp6375","Basalt of hill 6375, pyroclastic deposits"," Reddish-black cinder and scoriaceous ejecta overlie associated basalt flow. Include small cone at the north end of associated basalt flow that may be local splatter cone deposit derived from basalt flow. Main cone deposit, hill 6375, is about 64 m 290 ft  (...)"
"Qp6457","Basalt of hill 6457, pyroclastic deposits"," Reddish-black cinder and scoriaceous deposits. Include two smaller cones that partly overlie associated basalt flow from cone 6457. North cone may have erupted from the basalt flow. Pyroclastic cone hill 6457 is 36 m (120 ft) thick, and north cone about 2 (...)"
"Qp6588","Basalt of hill 6588, pyroclastic deposits"," Reddish-black to mostly black and gray ash, cinder, scoriaceous fragments, and basaltic boulders; partly consolidated. Include four pyroclastic cones aligned in 2-km-long 1-mi-long northwest-southeast trend. Deposits mostly overlie associated basalt flows (...)"
"Qp6646","Basalt of hill 6646, pyroclastic deposits"," Red and black cinder and scoriaceous deposits overlie associated basalt flow. Include one large pyroclastic cone and two adjacent small cones. There are three eruptive vent areas that formed the main cone aligned along a north-south strike, similar to nor (...)"
"Qps","Ponded sediments"," Gray or brown clay, silt, sand, and some lenses of gravel; partly consolidated by calcite and or gypsum cement. Locally include small chert and limestone fragments or pebbles. Similar to flood-plain Qf deposits but occupy man-made drainage depressions or  (...)"
"Qpvb","Basalt of Potato Valley, basalt flows"," Dark-gray alkali-olivine basalt. Flows on north side of Potato Valley erupted from unnamed cinder cone and flowed northwest about 3 km. Flow appears to have merged or coalesced with flows from two cones on west side of Potato Valley forming a basalt dam r (...)"
"Qpvp","Basalt of Potato Valley, pyroclastic deposits"," Red and black cinder, tuff, ash, and scoriaceous ejecta. Include two main pyroclastic cones on north and west sides of Potato Valley and five small pyroclastic vents. The two main cones appear to be the main sources for associated basalt flows that ring t (...)"
"Qr","Colorado River gravel and silt deposits"," Mud, silt, and fine- to coarse-grained sand and gravel interbedded with poorly sorted, angular- to well-rounded pebbles, cobbles, and boulders adjacent to Colorado River. Overlap and intertongue with local alluvial debris fans and flows. Young Qgy and old (...)"
"Qs","Stream-channel deposits"," Poorly sorted, interlensing silt, sand, pebbles, and gravel. Intertongue with or inset against young alluvial fan Qay, young terrace-gravel (Qgy), and upper part of valley alluvial (Qv) deposits, overlaps flood-plain (Qf) and ponded sediment (Qps) deposit (...)"
"Qsb","Sage Basalt, basalt flows"," Dark-gray, finely crystalline to glassy alkali-olivine basalt. Groundmass contains plagioclase, olivine, and augite laths. Includes abundant olivine phenocrysts 0.25–5 mm in diameter consisting of about 30 percent basalt in some outcrops. Overlies Harrisb (...)"
"Qsc","Eolian cinder sand sheet deposits"," Black, gray, and red, coarse-grained fragments of angular to subangular, glassy, basaltic and andesitic cinders and scoria. Material is derived from nearby pyroclastic volcanic centers; airborne ash and cinders were deposited within a few miles of local v (...)"
"Qsd","Silt dune deposits"," Brown and medium-gray clay, silt, and fine-grained sand composed of decomposed and weathered volcanic rock. Include subrounded to angular fragments of pebbles and cobbles of local basalt rocks about 4 to 6 inches 9.6 to 14.5 cm in diameter and as much as  (...)"
"Qsfp","Pumice of San Francisco Mountain"," White to light-gray, poorly sorted, mantle bedding of rhyolite pumice fall. Unit is matrix free except for locally reworked zone in upper 1 m 3 ft. Lapilli range from several millimeters to several centimeters in size, are colorless vesicular glass, and l (...)"
"Qslr","Rhyolite dome complex of Slate Mountain"," Light-gray aphanitic rhyolite. Rare microphenocrysts of pale-brown amphibole, biotite, and altered fayalite? occur in a felsic cryptocrystalline groundmass (Wolfe and others, 1987). Unit forms the north flank of a 1.5 km (1 mi) diameter cluster of domes t (...)"
"Qsp","Pyroclastic deposits of Shadow Mountain"," Black and red scoria, cinder, and ash deposits of olivine-labradorite basaltic composition. Deposits overlie associated basalt flows and strata of Petrified Forest and Shinarump Members of the Chinle Formation. About 183 m 600 ft thick."
"Qss","Sand sheet deposits"," White, brown, and gray, fine- to coarse-grained wind-blown sand. Composed primarily of quartz and feldspar grains derived from erosion of Tertiary sediments Ts in southwest half of map area. Composed of quartz grains and small chert fragments derived from (...)"
"Qt","Travertine deposits"," Gray and tan, stained light-red, massive, porous, cliff-forming freshwater limestone. Include angular clasts of local talus breccia or stream gravel. Formed by rapid chemical precipitation of calcium carbonate from springwater discharge as encrustations o (...)"
"Qtb","Tuckup Canyon Basalt, basalt flow"," Dark- to light-gray, finely crystalline alkali-olivine basalt. Most of the basalt came from a fissure-like dike Qti and pyroclastic cone (Qtp) vent area in unnamed western tributary of upper Tuckup Canyon (Billingsley, 1970). Basalt flowed into Tuckup Can (...)"
"Qtg","",""
"Qti","",""
"Qtp","Tuckup Canyon Basalt, pyroclastic deposits"," Red and reddish-gray cinders and scoriaceous glassy fragments of basalt; unconsolidated. Forms small cinder cone overlying associated basalt flow Qtb and part of Toroweap and Kaibab Formations (Pt, Pk) and Coconino Sandstone (Pc) in an unnamed western tri (...)"
"Qtr","Talus and rock-fall deposits"," Along Vermilion Cliffs; consists of red to yellow silt and sand mixed with angular rocks and boulders of light-red sandstone and dark-red siltstone; partly cemented by calcite. Form talus debris slopes in steep-walled canyons and on lower slopes of Vermil (...)"
"Qv","Valley-fill deposits"," Gray to light-red, slope-forming, unsorted mixture of mud, silt, sand, gravel, small pebbles, and cobbles. Partly consolidated by calcite and gypsum cement. Include sandstone, limestone, and chert clasts in sandy matrix locally derived from nearby Paleozo (...)"
"Qwb","",""
"Qyab","Basaltic andesite of S P Mountain"," Dark-gray basaltic andesite. Flow is more crystalline than associated basaltic pyroclastic deposits of S P Mountain Qyap. Flow has rough blocky surface and steep flow fronts. Basalt flowed northward about 6.5 km (4 mi) over Harrisburg Member of the Kaibab (...)"
"Qyap","Pyroclastic deposits of S P Mountain"," Dark-gray to reddish-gray basaltic andesite. Contain phenocrysts of clinopyroxene, olivine, and intensely corroded plagioclase in hypocrystalline groundmass of the same minerals, plus opaque oxide and glass. Same composition as basaltic andesite flow Qyab (...)"
"Qyb","Basalt flow of five young cinder cones"," Grayish-black porphyritic basalt flow with same composition as pyroclastic deposits of five young cinder cones Qyp. Consists of one small flow 700 m (2,297 ft) long and 400 m (1,315 ft) wide. About 5 to 10 m (16 to 33 ft) thick."
"Qyp","Pyroclastic deposits of five young cinder cones"," Grayish-black porphyritic basalt with abundant 1- to 3-mm phenocrysts of corroded tabular plagioclase, scattered olivine, and sparse clinopyroxene in a hyalophitic groundmass. Forms five young cinder cones overlying older cinder cones; 200 to 800 m 200 to (...)"
"T227i","227-Mile intrusive"," Informally named by Wenrich and others 1995. Gray alkali-olivine basalt dikes and sills exposed in Watahomigi Formation of the Supai Group, undivided (*Ms) about 4 km (2.5 mi) north of Colorado River Mile 227. K/Ar age of sill, 13.5±0.3 Ma (Wenrich and ot (...)"
"T2i","Dikes of Colorado River Mile 202"," Light-gray, coarsely to finely crystalline, olivine-augite basalt. Include three to four dikes that parallel and occupy northwest-trending joints, fractures, and minor faults in Paleozoic bedrock. Composition is basalt and andesite. K-Ar age is 5.76±0.26  (...)"
"TRc","Chinle Formation, undivided"," Includes the Shinarump and Petrified Forest Members. Shinarump Member locally missing or has undergone local facies change to sandstone lithology similar to sandstones in Petrified Forest Member. The Chinle Formation at Hells Hole is 21 km 13 mi north of  (...)"
"TRco","Chinle Formation, Owl Rock Member"," Grayish-red and light-purple, slope- and ledge-forming nodular limestone interbedded with purple, light-blue, and light-red calcareous siltstone and sandstone. Limestone beds are gray, cherty, lenticular, silty, irregular bedded 0.5 to 1.5 m 1 to 5 ft thi (...)"
"TRcp","Chinle Formation, Petrified Forest Member"," Purple, blue, light-red, reddish-purple, grayish-blue, slope-forming mudstone and siltstone and interbedded white, coarse-grained lenticular sandstone. Includes three informal units of Akers and others 1958, in ascending order: blue mudstone, gray mudston (...)"
"TRcs","Chinle Formation, Shinarump Member"," White to yellowish-brown, cliff-forming, thin- to thick-bedded, coarse-grained, low-angle crossbedded sandstone, gravel, and conglomeratic sandstone. Includes numerous small channel lenses and pockets of small pebble conglomerate composed of well rounded  (...)"
"TRm","Moenkopi Formation, undivided"," Red, slope-forming, fine-grained, thin-bedded, shaly siltstone and sandstone. Includes, in ascending order, the Wupatki Member, the Shnabkaib Member and lower massive sandstone member, and the Holbrook and Moqui Members, undivided. White, cliff-forming, c (...)"
"TRmhm","",""
"TRms","Moenkopi Formation, Shnabkaib Member"," Yellowish-white and light-brown, cliff-forming, crossbedded, fine-grained, calcareous and gypsiferous siltstone and dolomite and coarse-grained sandstone. Forms prominent white slope or ledge at south end of Vermilion Cliffs near U.S. Highway 89A south of (...)"
"TRmss","",""
"TRmw","Moenkopi Formation, Wupatki Member"," Red and red-brown, slope-forming, thin-bedded, mudstone, siltstone, and sandstone as defined by McKee 1954. Interbedded sandstones as thick as 1 to 3 ft (0.5 to 1 m) form resistant ledges within crumbly red-brown mudstone/siltstone slopes. Bedding surface (...)"
"Tao","Alluvial deposits"," Gray to dark-gray, slope-forming schist, granite, gneiss, and amphibole clasts derived from Proterozoic outcrops of the Virgin Mountains about 9 to 11 km 6 to 7 mi northwest of map area. Include clasts composed of white and gray angular chert, subrounded  (...)"
"Tay","Alluvium and calcrete soil deposits"," Gray and light-brown, slope-forming, silt, sand, coarse gravel in coarse-grained gravely matrix alluvium; includes subangular to well-rounded limestone and dolomite pebbles, cobbles, and boulders up to 1 m 3 ft in diameter. Include 8 basalt clasts derived (...)"
"Tb","Basalt flows"," Medium- to dark-gray plagioclase-phyric, aphyric, and slightly porphyritic basalt. Smooth surfaced, partly dissected north of Dog Knobs area and about 10 km 6 mi northeast of S P Mountain. Composed of plagioclase, clinopyroxene, olivine, and opaque oxides (...)"
"Tba","Volcanic rocks of the Mount Floyd Volcanic Field, basalt and andesite flows"," Dark- to light-gray, finely crystalline alkali-olivine basalt. Most of the basalt came from elongated fissure dikes Ti and vent areas beneath pyroclastic cone deposits (Tp). Basalt flowed onto flat, partly eroded Tertiary sedimentary rocks of freshwater l (...)"
"Tbb","Basalt of Bundyville, basalt flows"," Dark-gray, finely crystalline, olivine basalt. Groundmass contains olivine. Include one to three basalt flows that form a caprock overlying purple and white mudstone and sandstone beds of the Petrified Forest Member of the Chinle Formation. Flow surfaces  (...)"
"Tbi","Dike in ampitheater"," Dark-gray plagioclase-phyric basalt and mixed pyroclastic dikes and necks. Composed of plagioclase, clinopyroxene, olivine, and opaque oxides. Crystal-rich basalt; occurs in 2.7 km 1.5 mi wide basalt- and tuff-rimmed depression informally named the “Amphi (...)"
"Tbmb","Blue Mountain Basalt, basalt flows"," Dark-gray alkali-olivine basalt. Include small basalt flow on top of unnamed mesa 6.5 km 4 mi north of Blue Mountain of Aubrey Valley. Overlies old gravel and sedimentary (Ts1) deposits and young gravel and sedimentary (Tg) deposits. Source for basalt on  (...)"
"Tbmi","Blue Mountain Basalt, dikes and necks"," Dark-gray alkali-olivine basalt. Forms two small dikes, plugs, or necks southwest of basalt flow on top of unnamed mesa 6.5 km 4 mi north of Blue Mountain in Aubrey Valley. Highest elevation dike intrudes upper part of the Hermit Formation (Ph); lowest el (...)"
"Tbpb","Black Point basalt flows"," Dark-gray to black plagioclase-aphyric basalt; surface weathers smooth and locally dissected. Contain scattered to abundant tabular plagioclase phenocrysts as large as 1 cm in diameter and includes abundant olivine microphenocrysts in feldspathic groundma (...)"
"Tc","Volcanic rocks of the Hualapai Plateau, pyroclastic deposits"," Red basaltic pyroclastic cinder cone deposits at Grapevine Canyon, northwest corner of map area, west edge of Hualapai Plateau. Overlie Devonian and Mississippian strata on rim and within Grapevine Canyon and overlain by thick alkali-olivine basalt flows  (...)"
"Teb","Basalt north of Mount Emma, basalt flows"," Near Mount Emma, gray-black alkali-olivine basalt; plagioclase laths common in glassy groundmass. Consist of several basalts that flowed east and south from plug Tei area. Underlying strata concealed, but because of similar elevation as basalt of Mount Lo (...)"
"Tei","Basalt north of Mount Emma, intrusive rocks"," Gray-black alkali-olivine basaltic plug or dike. Unit partly exposed and offset by the Hurricane Fault. Most of unit covered by landslide deposits Ql. Width of plug is probably in excess of 90 m (300 ft) and appears to be source of Tertiary basalt flows n (...)"
"Tep","Basalt north of Mount Emma, pyroclastic deposits"," Reddish-black cinder, scoria, ash, and other scoriaceous ejecta; deeply eroded. Associated with intrusive plug Tei on downthrown side of Hurricane Fault north of Mount Emma. Thickness, 12 m (40 ft)."
"Tg","",""
"Tgb","Grassy Mountain Basalt, pyroclastic deposits"," Dark-gray, finely crystalline, alkali-olivine basalt; olivine phenocrysts averaging 1 mm in diameter form about 25 percent of rock sample from interior of basalt flow. One or more flows interbedded with pyroclastic deposits near dikes. Basalts flowed gene (...)"
"Tgc","Rocks of the Grand Wash Trough, paleozoic-clast conglomerate"," Gray, cliff-forming, rounded to subrounded clasts of Paleozoic limestone and sandstone from 1 to 70 cm 1 to 28 in in diameter mixed with coarse gravel and conglomerate derived from Paleozoic rocks of the Colorado Plateau. Consolidated by calcium and gypsu (...)"
"Tgg","Rocks of the Grand Wash Trough, gypsum and gypsiferous siltstone facies"," Gray and gray-white gypsum, greenish-gray, light-red, and reddish-gray gypsiferous siltstone and mudstone. Upper 15 to 20 m 50 to 65 ft consists mostly of multicolored, banded, thin-bedded mudstone and gypsiferous siltstone interbedded with thin-bedded (0 (...)"
"Tgi","Grassy Mountain Basalt, intrusive dikes"," Dark-gray, finely crystalline, alkali-olivine basalt. Source areas for associated basalt flows and pyroclastic deposits on Grassy Mountain. Dikes are aligned with nearly vertical east-west bedrock joints and fractures of this area. Widths, 0.5 to 2 m 1 to (...)"
"Tgl","Rocks of the Grand Wash Trough, limestone and siltstone facies"," Gray, silty, crystalline limestone, light-red, gray, and greenish-gray gypsiferous siltstone, gray to reddish-gray calcareous sandstone, and gray to white gypsum. Limestone beds are vuggy, irregularly bedded, 1 to 10 m 3 to 30 ft thick. Contain abundant p (...)"
"Tgp","Grassy Mountain Basalt, basalt flows"," Red to reddish-black, angular, scoriaceous cinder fragments and ash deposits; unconsolidated. Spatially associated with intrusive dikes; interbedded with local basalt flows Tgb. Thickness, 1 to 6 m (3 to 20 ft)."
"Tgr","Rocks of the Grand Wash Trough, red siltstone, sandstone, and conglomerate facies"," Dark-red to orange-red, slope-forming, medium- to fine-grained, gypsiferous siltstone and sandstone overlain by cliff-forming, gray to light-orange-brown, coarse- to fine-grained, poorly sorted, consolidated silt, sand, gravel, and conglomerate. Clasts in (...)"
"Tgs","Gravel and sedimentary deposits"," Gray, brown, and white clay, sand, silt, and gravel, poorly sorted; consolidated. Unit consists mostly of fine-grained gray silty sand that includes scattered pebbles and cobbles of well-rounded gray sandstone and limestone derived from Jurassic and Creta (...)"
"Tgx","Proterozoic-clast conglomerate facies"," Dark-gray to reddish-brown, cliff- to resistant slope-forming conglomerate. Includes interbedded lenses of gravel and sandstone, poorly sorted and moderately well bedded; consolidated. Clasts are composed of reddish-brown, brown, red, grayish-green, and l (...)"
"Thma","Andesite flows of Howard Mesa"," Dark-gray to gray-black andesite; includes two lobes extending into map area from the south. Contains scattered phenocrysts of plagioclase and quartz 1/8 inch in diameter. Plagioclase is intensely corroded; quartz is less abundant, is corroded and has pyr (...)"
"Ths","Horse Spring Formation, Rainbow Gardens Member"," Includes basal conglomerate and middle limestone and sandstone unit. Consists of complex intertonguing sequence of clastic and carbonate lithofacies. Upper unit of the Rainbow Gardens Member is not exposed within map area but is assumed to be present in s (...)"
"Ti","Volcanic rocks of the Hualapai Plateau, intrusive dikes"," Dark-gray basalt composed of plagioclase, clinopyroxene, olivine, and opaque oxides. Dikes occur in Moenkopi Wash southwest of Tuba City, in Hamblin Wash south of The Gap, at Tuba Butte northwest of Tuba City, and at Wildcat Peak northeast of Tuba City. D (...)"
"Tmb","Basalt of Mount Trumbull, basalt flows"," Gray-black, finely crystalline, alkali-olivine basalt. Groundmass contains olivine phenocrysts and plagioclase laths. Consist of one or more thin basalt flows that form caprock overlying concealed purple and white mudstone and sandstone beds of the Petrif (...)"
"Tmi","Basalt of Mount Trumbull, intrusive rocks"," Gray-black, finely crystalline, alkali-olivine basalt. Forms highest point on north side of Mount Trumbull elev. 2,447 m [8,029 ft]. Source for Tertiary basalt flows on Mount Trumbull. Width, 120 m (400 ft) or more."
"Tmlb","Basalt of Mount Logan, basalt flows"," Light-gray, finely crystalline, alkali-olivine basalt; contains red and green olivine phenocrysts 1 mm in diameter in glassy groundmass; includes plagioclase laths in glassy groundmass. Plagioclase masses form white spotted blotches in some areas. Basalt  (...)"
"Tocb","Basalt flow of Cedar Ranch Mesa"," Dark-gray, massive, olivine-phyric basalt; weathers brown and has a smooth surface. Contains abundant 1- to 3-mm subhedral to euhedral olivine phenocrysts rimmed with iddingsite in a distinctive holcrystalline groundmass of intergranular to subophitic cli (...)"
"Tp","Pyroclastic deposits"," Dark-gray to red cinder and spatter fragments; weathers yellowish brown, brown, or reddish brown. Composed of clinopyroxene and olivine phenocrysts, plagioclase, opaque oxides, and glass; partly decomposed and weathers light red. Mass wasting has diminish (...)"
"Tp6i","Dikes of Parashant Canyon and Hundred and Ninetysix Mile Creek"," Dark-gray, fine-grained to coarsely crystalline, olivine-augite basalt. Dikes commonly form recessive cracks in limestone rocks of canyon walls that appear as open eroded joints. Commonly eroded and chemically altered or decomposed, especially near Colora (...)"
"Tpb","Poverty Mountain Basalt, basalt flows"," Medium-gray to light-gray, finely crystalline, alkali-olivine basalt. Include augite and olivine phenocrysts less than 1 mm in diameter in glassy groundmass. Basalt overlies gently east-northeast-dipping 2° average upper red member and Shnabkaib Member of (...)"
"Tpi","Poverty Mountain Basalt, intrusive neck"," Medium-gray, finely crystalline, alkali-olivine basalt. Forms small dike associated with basalt flows and pyroclastic deposits near eastern part of mountain. Dike and nearby small pyroclastic vents are aligned northwest-southeast and are main sources for  (...)"
"Tpkb","Basalt of Poverty Knoll, basalt flow"," Light-gray, finely crystalline, alkali-olivine basalt containing plagioclase laths and olivine phenocrysts 1 mm in diameter in glassy groundmass; contains about 35 percent olivine phenocrysts. Flow emerged from central dike and flowed in radial pattern ov (...)"
"Tpki","Basalt of Poverty Knoll, intrusive dike"," Light-gray, finely crystalline, alkali-olivine basalt. Forms small knoll, center-top of Poverty Knoll. "
"Tpp","Poverty Mountain Basalt, pyroclastic deposits"," Reddish-black and red fragments of scoria, cinders, and small ribbons overlie basalt flows at and near vent areas. Interbedded with basalt flows near dike Tpi and pyroclastic cone areas. Largest cone is about 25 m (80 ft) thick."
"Tr","Volcanic rocks of the Mount Floyd Volcanic Field, rhyolite, rhyodacite, and obsidian flows"," Light gray, dark red, and grayish-black. Obsidian flows are mostly black obsidian but often contain black and gray-banded obsidian or red to red and black obsidian east of Red Lake and southwest of Black Tank Camp sec. 18, T. 26 N., R. 4 W.. 40Ar/39Ar age (...)"
"Trb","Volcanic  rocks of the San Francisco Volcanic Field, basalt flow of Red Butte"," Basalt flow of Red Butte Miocene—Dark-gray olivine basalt. Weathers brown; massive flow. K/Ar age, 8.92±0.23 Ma (Wolfe and others, 1987), 9.73±0.91 Ma and 8.78±0.22 Ma (Reynolds and others, 1986). Forms basalt caprock over thin soil deposit 3 to 5 ft (1 t (...)"
"Tri","Volcanic rocks of the Mount Floyd Volcanic Field, rhyolite, rhyodacite, obsidian dikes, necks, vents"," Red, gray, and black rhyolite and rhyodacite. Rhyolite exhibits convoluted and twisted thin platy flow patterns; weathered outcrops resemble roof shingles. Map contacts are approximate because erosion has not fully exposed extent of these intrusive featur (...)"
"Trm","",""
"Ts","Sedimentary rocks"," Light-red, gray, and white interbedded siltstone, sandstone, arkosic gravel, lenticular conglomerate, and gray, thin-bedded [1 to 3 ft 0.5 to 1 m] freshwater limestone. Limestone beds contain long vertical tubular structures generally ½ inch (0.12 cm) in  (...)"
"Ts1","",""
"Ts2","",""
"Tsb","Shivwits Basalt, basalt flows"," Gray-black, finely crystalline, alkali-olivine basalt. Groundmass contains olivine phenocrysts and plagioclase laths. Consist of one or more thin basalt flows overlying red and white mudstone, siltstone, sandstone, and gypsifereous siltstone beds of the M (...)"
"Tsgb","Snap Point Basalt and Garrett Dikes, basalt flows"," Dark-gray alkali-olivine basalt. Basalt originates from dike source near highest part of Snap Point. Consists of two separate basalt flows, one flowed east about 2.4 km 1.5 mi down drainage eroded into Fossil Mountain Member of the Kaibab Formation (Pk) o (...)"
