"abbreviation","name","short description"
"Tsgi","Snap Point Basalt and Garrett Dikes, intrusive dikes"," Dark-gray, greenish, finely crystalline, alkali-olivine basalt. Contain phenocrysts of augite and olivine less than 1 mm in diameter. Form near-vertical dikes orientated in north-south alignment parallel to local joints and fractures in Paleozoic bedrock  (...)"
"Tsi","Shivwits Basalt, intrusive rocks"," Gray-black, finely crystalline, alkali-olivine basalt. Approximate map contact. Source for extensive basalt flows and pyroclastic deposits on the southern Shivwits Plateau west of Grand Canyon average elev. 1,829 m [6,000 ft]. Dikes align about N. 30° W., (...)"
"Tsp","Basalt of the Shivwits Plateau, pyroclastic deposits"," Reddish-black scoria and cinder fragments, partly consolidated. Form small pyroclastic cones, heavily eroded and partly covered by basalt flows. Often interbedded with basalt flows near vent areas. Thickness, 12 m 40 ft."
"Tv","Volcanic rocks of the Hualapai Plateau, andesite flows and basalt flows, undivided"," Volcanic deposits on the Hualapai Plateau are alkali-olivine basalt and andesitic basalt flows, agglomerate, volcanogenic fluvial sediments, and rhyolite ash flows derived from local and distant sources. Deposits include the Separation Hill basalt near th (...)"
"Tvi","",""
"Twb","Whitmore Dike Swarm, basalt flow"," Dark-gray to black alkali-olivine basalt. Includes small olivine phenocrysts and plagioclase laths in glassy groundmass. Basalt emerged from dike Twi in lower part of Hermit Formation (Ph) and flowed down steep debris slope descending about 60 m (200 ft)  (...)"
"Twi","Whitmore Dike Swarm, intrusive dikes"," Dark-gray to black alkali-olivine basalt. K-Ar age, 4.56±0.12 Ma Wenrich and others, 1995. Form nearly vertical dikes eroded down to bedrock surface of Esplanade Sandstone and Pakoon Limestone (Pep) about 2 km (1.3 mi) southwest of Whitmore Canyon and 3 k (...)"
"Tyb","Volcanic  rocks of the San Francisco Volcanic Field, young basalt flows"," Medium- to dark-gray basalt; includes plagioclase-phyric, aphyric, and slightly porphyritic basalt. Smooth surfaced, partly dissected. Composed of plagioclase, clinopyroxene, olivine, and opaque oxides. Thickness less than 90 ft 28 m."
"Tyi","Volcanic  rocks of the San Francisco Volcanic Field, young intrusive rocks"," Dark-gray basalt and mixed pyroclastic dikes and necks. Composed of plagioclase, clinopyroxene, olivine, and opaque oxides. Intrusives from 4 to 20 ft 1.2 to 6 m wide."
"Typ","Volcanic  rocks of the San Francisco Volcanic Field, young pyroclastic deposits"," Dark-gray to red cinder and spatter fragments; weather yellowish-brown, brown, or reddish-brown. Composed of clinopyroxene and olivine phenocrysts, plagioclase, opaque oxides, and glass. Mass wasting has diminished slope angles of pyroclastic cones; flank (...)"
"Xbr","Brahma Schist"," Consists of amphibolite, hornblende-biotite-plagioclase schist, biotiteplagioclase schist, orthoamphibole-bearing schist and gneiss, and metamorphosed sulfide deposits. Mafic to intermediate-composition metavolcanic rocks. About 1.75 Ga. Locally interlaye (...)"
"Xc","Carbonate and chert"," A few meters thick interval of carbonate rock and chert nodules within an orthoamphibole schist, one location only, below Colorado River Mile 237. "
"Xdg","Diorite, gabbro, and anorthosite"," About 1.74 to 1.72 Ga. "
"Xec","Elves Chasm pluton"," Oldest plutonic rocks, possible “basement” substrate. Contains mafic hornblende-biotite tonalite and intermediate-composition plutonic units (quartz diorite), including tabular amphibolite bodies that may be dikes. About 1.84 Ga ."
"Xg","Granite"," Unfolded to weakly foliated, medium- to fine-grained muscovite-biotite, granitic pegmatite and aplite dikes, sills, and small plutons. U-Pb zircon ages range from 1,685 to 1,680±1 Ma Hawkins and others, 1996."
"Xgd","Granodiorite-gabbro-diorite and granodiorite complexes"," Weakly to well-foliated, medium- to coarse-grained quartz-plagioclase and diorite-hornblende-bearing granitoids of probable volcanic arc origin 1.74 to 1.71 Ga."
"Xgr","Granite, granitic pegmatite and aplite"," Granite plutons and stocks and pegmatite and aplite dikes emplaced synchronously with peak metamorphism. One small outcrop in map area is at Colorado River Mile 190 just south of Whitmore Canyon junction with Colorado River. About 1.7–1.66 Ma Ilg and othe (...)"
"Xm","Mafic metavolcanic rocks"," Biotite hornblende schist and amphibolite. Contains abundant biotite and garnet. Equivalent to Brahma Schist of eastern Grand Canyon. "
"Xo","Orthoamphibole schist"," Regolith. An interval several meters thick of weathered detritus eroded from older plutonic rocks. Metamorphic monazite from pelitic schist containing garnet, kyanite, gedrite, sillimanite, and cordierite. Very small outcrops along Colorado River within G (...)"
"Xr","Rama Schist and Gneiss"," Massive, fine-grained quartzofeldspathic schist and gneiss of probable felsic metavolcanic rocks. About 1.75 Ga. Locally interlayered with Brahma Schist Xbr and Vishnu Schist (Xv) ."
"Xs","Schist"," Quartz-mica, schist, and pelitic schist. "
"Xu","Crystalline rocks, undivided"," Undivided intrusive and metamorphic rocks. Includes granite plutons, stocks, and pegmatite and aplite dikes, gabbro-diorite, and granodiorite rocks, garnet schist, hornblende-biotite schist, orthoamphibole-bearing schist and gneiss, and probable felsic me (...)"
"Xum","Ultramafic rocks"," Probable cumulate origin as supracrustal rocks. "
"Xv","Vishnu Schist"," Quartz-mica schist, pelitic schist, and meta-arenites of probable volcanic arc basin origin. Locally contains graded bedding and turbidite layering. Strongly foliated with multiple generations of folds and foliations Ilg and others, 1996."
"YZn","Nankoweap Formation, undivided"," Unconformity-bounded Nankoweap Formation separates rocks of the Neoproterozoic Chuar Group and Late Mesoproterozoic Unkar Group. Includes an upper and lower member, undivided Gebel, 1978. Upper member is composed of siltstone and thick-bedded, fine-graine (...)"
"Yb","Bass Formation"," Red-brown and reddish-gray, ledge-forming dolomite, silty sandstone, and conglomerate. Includes basal Hotauta Conglomerate Member as defined by Dalton 1972. Consists of fine- to coarse-grained, thin- to mediumbedded dolomite, fine- to coarse-grained, thin (...)"
"Yc","Cardenas Basalt"," Includes informal members, in descending order: the lapillite, fan-jointed, and bottle-green members Lucchitta and Hendricks, 1983. Lapillite member is composed of scoriaceous fragments of volcanic bombs and ash matrix interbedded in massive basalt flows  (...)"
"Yd","Dox Formation"," Includes, in descending order, Ochoa Point, Comanche Point, Solomon Temple, and Escalante Creek Members as defined by Stevenson and Beus 1982. Of these, only part of the Escalante Creek is exposed in map area. Upper two-thirds or more of the Dox is remove (...)"
"Ydc","Dox Formation, Comanche Point Member"," Light-red, pale-green to white, slope-forming, mudstone and siltstone and minor thin-bedded sandstone. Includes mud cracks, ripple marks, salt casts, wavy to irregular bedding, and stromatolitic dolomite beds within or adjacent to white siltstone beds. Th (...)"
"Yde","Dox Formation, Escalante Creek Member"," Light-brown to greenish-brown sandstone, calcareous sandstone, and arkosic sandstone. Includes an upper dark-brown to green shale and mudstone. Thickness, 1,278 ft 390 m."
"Ydo","Dox Formation, Ochoa Point Member"," Red slope- and cliff-forming micaceous mudstone that grades upward into red quartz sandstone and silty sandstone. Includes salt-crystal casts in mudstone and asymmetrical ripple marks and small-scale crossbeds in sandstone. Thickness, 250 to 300 ft 976 to (...)"
"Yds","Dox Formation, Solomon Temple Member"," Cyclical sequence of red mudstone, siltstone, and quartz sandstone. Includes thin beds of argillaceous dolomite or calcareous siltstone. Mud cracks and ripple marks are common. Thickness, 920 ft 280 m."
"Yg","Young granite and pegmatite"," Granite plutons, stocks, dikes, and pegmatite. About 1.4 Ga billion years old."
"Yh","Hakatai Shale, undivided"," Orange-red, purple, and red mudstone, shale, and sandstone. Forms an upper cliff unit, a middle slope unit, and a lower slope unit. Upper cliff unit consists of pale-purple or lavender, fine- to coarse-grained, thin- to mediumbedded, cross-bedded sandston (...)"
"Yi","Unnamed diabase sills and dikes"," Black, medium- to coarse-grained, olivine-rich diabase. Contains plagioclase, olivine, clinopyroxene, magnetite-ilmenite, and biotite. Diabase sills and dikes intrude all rocks within Unkar Group below Cardenas Basalt. Chemical variation diagrams indicate (...)"
"Ys","Shinumo Sandstone, undivided"," Red-brown, purple, and gray, cliff-forming sandstone. Includes four undivided informal members as defined by Daneker 1975. In descending order, they are upper, upper middle, lower middle, and lower sandstone members. Upper member consists of red-brown and (...)"
"Zgcc","Galeros Formation, Carbon Canyon Member"," Fine-grained, interbedded siliciclastic mudstone, siltstone, and sandstone. Includes several thin dolomite and sandstone marker beds, 3 to 6 ft 1 to 2 m thick. Sandstone beds contain symmetric and interference ripple marks, low-angle crossbeds, and mud-cr (...)"
"Zgd","Galeros Formation, Duppa Member"," Fine-grained siliciclastic unit dominated by shale and interbedded thin-bedded siltstone. Includes interbedded calcareous siltstone beds about 3 ft 1 m thick. Variable thickness, 571 to 2,050 ft (174 to 625 m)."
"Zgj","Galeros Formation, Jupiter Member"," Fine-grained, interbedded siliciclastic mudstone, siltstone, sandstone, and dolomite. Dolomite and some sandstone beds form several marker beds throughout unit. Base of unit is stromatolitic dolomite, 40 ft 912 m thick. Interbedded sandstone beds contain  (...)"
"Zgt","Galeros Formation, Tanner Member"," Very fine grained siliciclastic siltstone, sandstone, and thin dolomite. Include dark-brown dolomite at base of unit that unconformably overlies sandstone beds of the Nankoweap Formation. Thickness, 20 to 80 ft 6 to 24 m."
"Zka","Kwagunt Formation, Awatubi Member"," Red, green, blue, and light-brown mudstone, siltstone, and sandstone. A basal tan to light-brown stromatolite carbonate bed contains fossil biohermal dome features. Thin-bedded sandstone and siltstone contain ripple foreset beds and mud-crack casts. Near  (...)"
"Zkcb","Kwagunt Formation, Carbon Butte Member"," Interbedded sandstone and siltstone. Basal sandstone is brown, medium- to fine-grained, thick sandstone, forming a distinctive marker bed approximately 252 ft 76 m thick, and includes abundant soft-sediment deformation features, interference ripple marks, (...)"
"Zkw","Kwagunt Formation, Walcott Member"," Black to gray mudstone, gray dolomitic sandstone 12 to 31 ft [4 to 9.5 m] thick, brecciated dolomite and sandstone. A thin tephra deposit yielded a U-Pb zircon age of 742±6 Ma, providing an upper age limit for the Chuar Group (Karlstrom and others, 2000). (...)"
"Zs","Sixtymile Formation, undivided"," Informally divided into, in descending order, the lower, middle, and upper members Elston, 1979. Lower member is composed of slumped blocks of dolomite surrounded by black shale exposed mainly in Sixtymile Canyon in eastern Grand Canyon. Middle member is  (...)"
"lPMs","",""
"river","",""
"water","",""
